{
  "project": "Binge",
  "status": "captured-authoritative-inventory",
  "media": [
    {
      "id": "2-broke-girls",
      "title": "2 Broke Girls",
      "type": "tv_show",
      "source": "authoritative-list"
    },
    {
      "id": "9-1-1",
      "title": "9-1-1",
      "type": "tv_show",
      "source": "authoritative-list"
    },
    {
      "id": "9-1-1-lone-star",
      "title": "9-1-1: Lone Star",
      "type": "tv_show",
      "source": "authoritative-list"
    },
    {
      "id": "american-dad",
      "title": "American Dad!",
      "type": "tv_show",
      "source": "authoritative-list"
    },
    {
      "id": "attack-on-titan",
      "title": "Attack on Titan",
      "type": "tv_show",
      "source": "authoritative-list"
    },
    {
      "id": "better-call-saul",
      "title": "Better Call Saul",
      "type": "tv_show",
      "source": "authoritative-list"
    },
    {
      "id": "big-mouth",
      "title": "Big Mouth",
      "type": "tv_show",
      "source": "authoritative-list"
    },
    {
      "id": "bojack-horseman",
      "title": "BoJack Horseman",
      "type": "tv_show",
      "source": "authoritative-list"
    },
    {
      "id": "breaking-bad",
      "title": "Breaking Bad",
      "type": "tv_show",
      "source": "authoritative-list"
    },
    {
      "id": "csi",
      "title": "CSI",
      "type": "tv_show",
      "source": "authoritative-list"
    },
    {
      "id": "csi-miami",
      "title": "CSI: Miami",
      "type": "tv_show",
      "source": "authoritative-list"
    },
    {
      "id": "chainsaw-man",
      "title": "Chainsaw Man",
      "type": "tv_show",
      "source": "authoritative-list"
    },
    {
      "id": "chicago-fire",
      "title": "Chicago Fire",
      "type": "tv_show",
      "source": "authoritative-list"
    },
    {
      "id": "chicago-med",
      "title": "Chicago Med",
      "type": "tv_show",
      "source": "authoritative-list"
    },
    {
      "id": "chicago-pd",
      "title": "Chicago P.D.",
      "type": "tv_show",
      "source": "authoritative-list"
    },
    {
      "id": "clarksons-farm",
      "title": "Clarkson's Farm",
      "type": "tv_show",
      "source": "authoritative-list"
    },
    {
      "id": "class",
      "title": "Class",
      "type": "tv_show",
      "source": "authoritative-list"
    },
    {
      "id": "classic-doctor-who",
      "title": "Classic Doctor Who",
      "type": "tv_show",
      "source": "authoritative-list"
    },
    {
      "id": "cyberpunk-edgerunners",
      "title": "Cyberpunk: Edgerunners",
      "type": "tv_show",
      "source": "authoritative-list"
    },
    {
      "id": "death-note",
      "title": "Death Note",
      "type": "tv_show",
      "source": "authoritative-list"
    },
    {
      "id": "demon-slayer",
      "title": "Demon Slayer",
      "type": "tv_show",
      "source": "authoritative-list"
    },
    {
      "id": "doctor-who",
      "title": "Doctor Who",
      "type": "tv_show",
      "source": "authoritative-list"
    },
    {
      "id": "exploding-kittens",
      "title": "Exploding Kittens",
      "type": "tv_show",
      "source": "authoritative-list"
    },
    {
      "id": "extra-gear",
      "title": "Extra Gear",
      "type": "tv_show",
      "source": "authoritative-list; Wikipedia; IMDb",
      "release_year": 2016,
      "status": "ended",
      "media_type": "web_series"
    },
    {
      "id": "from",
      "title": "FROM",
      "type": "tv_show",
      "source": "authoritative-list"
    },
    {
      "id": "failed-backdoor-pilots",
      "title": "Failed Backdoor Pilots",
      "type": "tv_show",
      "source": "authoritative-list"
    },
    {
      "id": "family-guy",
      "title": "Family Guy",
      "type": "tv_show",
      "source": "authoritative-list"
    },
    {
      "id": "futurama",
      "title": "Futurama",
      "type": "tv_show",
      "source": "authoritative-list"
    },
    {
      "id": "georgie-mandys-first-marriage",
      "title": "Georgie & Mandy's First Marriage",
      "type": "tv_show",
      "source": "authoritative-list"
    },
    {
      "id": "gravity-falls",
      "title": "Gravity Falls",
      "type": "tv_show",
      "source": "authoritative-list"
    },
    {
      "id": "greys-anatomy",
      "title": "Grey's Anatomy",
      "type": "tv_show",
      "source": "authoritative-list"
    },
    {
      "id": "grimm",
      "title": "Grimm",
      "type": "tv_show",
      "source": "authoritative-list"
    },
    {
      "id": "house-md",
      "title": "House M.D.",
      "type": "tv_show",
      "source": "authoritative-list"
    },
    {
      "id": "housos",
      "title": "Housos",
      "type": "tv_show",
      "source": "authoritative-list"
    },
    {
      "id": "human-resources",
      "title": "Human Resources",
      "type": "tv_show",
      "source": "authoritative-list"
    },
    {
      "id": "it-welcome-to-derry",
      "title": "IT: Welcome to Derry",
      "type": "tv_show",
      "source": "authoritative-list"
    },
    {
      "id": "invincible",
      "title": "Invincible",
      "type": "tv_show",
      "source": "authoritative-list"
    },
    {
      "id": "james-may-oh-cook",
      "title": "James May: Oh Cook!",
      "type": "tv_show",
      "source": "authoritative-list"
    },
    {
      "id": "james-may-our-man-in",
      "title": "James May: Our Man in...",
      "type": "tv_show",
      "source": "authoritative-list"
    },
    {
      "id": "jujutsu-kaisen",
      "title": "Jujutsu Kaisen",
      "type": "tv_show",
      "source": "authoritative-list"
    },
    {
      "id": "k-9",
      "title": "K-9",
      "type": "tv_show",
      "source": "authoritative-list"
    },
    {
      "id": "k-9-and-company",
      "title": "K-9 and Company",
      "type": "tv_show",
      "source": "authoritative-list"
    },
    {
      "id": "lucifer",
      "title": "Lucifer",
      "type": "tv_show",
      "source": "authoritative-list"
    },
    {
      "id": "manifest",
      "title": "Manifest",
      "type": "tv_show",
      "source": "authoritative-list"
    },
    {
      "id": "minecraft-story-mode",
      "title": "Minecraft: Story Mode",
      "type": "tv_show",
      "source": "authoritative-list; Telltale; Minecraft Wiki",
      "media_type": "episodic_narrative_game"
    },
    {
      "id": "ncis",
      "title": "NCIS",
      "type": "tv_show",
      "source": "authoritative-list"
    },
    {
      "id": "new-doctor-who",
      "title": "New Doctor Who",
      "type": "tv_show",
      "source": "authoritative-list"
    },
    {
      "id": "one-piece",
      "title": "One Piece",
      "type": "tv_show",
      "source": "authoritative-list"
    },
    {
      "id": "one-piece-live-action",
      "title": "One Piece Live Action",
      "type": "tv_show",
      "source": "authoritative-list"
    },
    {
      "id": "one-punch-man",
      "title": "One-Punch Man",
      "type": "tv_show",
      "source": "authoritative-list"
    },
    {
      "id": "orange-is-the-new-black",
      "title": "Orange Is the New Black",
      "type": "tv_show",
      "source": "authoritative-list"
    },
    {
      "id": "ouran-high-school-host-club",
      "title": "Ouran High School Host Club",
      "type": "tv_show",
      "source": "authoritative-list"
    },
    {
      "id": "president-curtis",
      "title": "President Curtis",
      "type": "tv_show",
      "source": "authoritative-list; Wikipedia; IMDb",
      "release_year": 2026,
      "status": "released",
      "media_type": "tv_series"
    },
    {
      "id": "reacher",
      "title": "Reacher",
      "type": "tv_show",
      "source": "authoritative-list"
    },
    {
      "id": "red-dwarf",
      "title": "Red Dwarf",
      "type": "tv_show",
      "source": "authoritative-list"
    },
    {
      "id": "rick-and-morty",
      "title": "Rick and Morty",
      "type": "tv_show",
      "source": "authoritative-list"
    },
    {
      "id": "rick-and-morty-the-anime",
      "title": "Rick and Morty: The Anime",
      "type": "tv_show",
      "source": "authoritative-list"
    },
    {
      "id": "spy-family",
      "title": "SPY × FAMILY",
      "type": "tv_show",
      "source": "authoritative-list"
    },
    {
      "id": "sassy-the-sasquatch",
      "title": "Sassy the Sasquatch",
      "type": "tv_show",
      "source": "authoritative-list; Tubi; IMDb",
      "release_year": 2022,
      "status": "ended",
      "media_type": "web_series"
    },
    {
      "id": "shameless",
      "title": "Shameless",
      "type": "tv_show",
      "source": "authoritative-list"
    },
    {
      "id": "smiling-friends",
      "title": "Smiling Friends",
      "type": "tv_show",
      "source": "authoritative-list"
    },
    {
      "id": "south-park",
      "title": "South Park",
      "type": "tv_show",
      "source": "authoritative-list"
    },
    {
      "id": "stewie",
      "title": "Stewie",
      "type": "tv_show",
      "source": "authoritative-list"
    },
    {
      "id": "stuck-in-the-middle",
      "title": "Stuck in the Middle",
      "type": "tv_show",
      "source": "authoritative-list"
    },
    {
      "id": "stuck-in-the-store",
      "title": "Stuck in the Store",
      "type": "tv_show",
      "source": "authoritative-list"
    },
    {
      "id": "supernatural",
      "title": "Supernatural",
      "type": "tv_show",
      "source": "authoritative-list"
    },
    {
      "id": "supernatural-the-animation",
      "title": "Supernatural: The Animation",
      "type": "tv_show",
      "source": "authoritative-list"
    },
    {
      "id": "superwog",
      "title": "Superwog",
      "type": "tv_show",
      "source": "authoritative-list"
    },
    {
      "id": "tales-of-the-tardis",
      "title": "Tales of the TARDIS",
      "type": "tv_show",
      "source": "authoritative-list"
    },
    {
      "id": "teen-titans-go",
      "title": "Teen Titans Go!",
      "type": "tv_show",